card_key,arcana_type,arcana_number,suit,rank,element,default_name_en,default_arcana_label_en,notes_for_writer,content_name_en,content_arcana_label_en,content_primary_keyword_en,content_keywords_en,content_artwork_en,content_summary_upright_en,content_summary_reversed_en,content_theme_general_upright_en,content_theme_general_reversed_en,content_theme_work_upright_en,content_theme_work_reversed_en,content_theme_relationship_upright_en,content_theme_relationship_reversed_en,content_theme_money_upright_en,content_theme_money_reversed_en,content_theme_mind_upright_en,content_theme_mind_reversed_en,content_name_vi,content_arcana_label_vi,content_primary_keyword_vi,content_keywords_vi,content_artwork_vi,content_summary_upright_vi,content_summary_reversed_vi,content_theme_general_upright_vi,content_theme_general_reversed_vi,content_theme_work_upright_vi,content_theme_work_reversed_vi,content_theme_relationship_upright_vi,content_theme_relationship_reversed_vi,content_theme_money_upright_vi,content_theme_money_reversed_vi,content_theme_mind_upright_vi,content_theme_mind_reversed_vi
the-fool,major,0,"","","",The Fool,Major Arcana · 0,Major Arcana. Fill all content_* columns.,The Fool,Major Arcana · 0,Leap,Leap|Freedom|Beginnings|Faith,"The open edge, light pack, and upward sky suggest freedom, vulnerability, and the soul beginning again.",A new road opens when innocence is willing to step before certainty arrives.,"The shadow appears as carelessness, drifting, or confusing freedom with avoiding consequence.",A new road opens when innocence is willing to step before certainty arrives.,"Carelessness, drifting, or confusing freedom with avoiding consequence.","At work, trust the leap with open eyes.","At work, carelessness, drifting, or confusing freedom with avoiding consequence.","In relationships, trust the leap with open eyes.","In relationships, carelessness, drifting, or confusing freedom with avoiding consequence.","With money, trust the leap with open eyes.","With money, carelessness, drifting, or confusing freedom with avoiding consequence.","Mentally, trust the leap with open eyes.","Mentally, carelessness, drifting, or confusing freedom with avoiding consequence.",Kẻ Khờ,Ẩn Chính · 0,Bước Nhảy,Bước Nhảy|Tự Do|Khởi Đầu|Niềm Tin,"Vực sáng, hành trang nhẹ, và bầu trời mở rộng gợi ra tự do, sự mong manh, và linh hồn đang bắt đầu lại.","Vũ trụ đang bật đèn xanh rực rỡ cho bạn nhảy một cú thật xa. Sự ngây thơ thuần khiết nghĩa là buông bỏ nhu cầu kiểm soát kết quả. Một con đường mới chỉ mở ra khi bạn thực sự bước lên nó, nên hãy tin tưởng vào cú nhảy với đôi mắt mở to. Hãy vứt bỏ những định kiến cũ kỹ và cho phép bản thân được tò mò như một đứa trẻ.","Bạn không hề 'tự do tự tại', bạn chỉ đang chạy trốn khỏi trách nhiệm thực sự của mình thôi. Bơ tin nhắn hay phớt lờ deadline không phải là giải thoát, mà là tạo ra một mớ hỗn độn. Bạn đang từ chối một bước ngoặt cần thiết chỉ vì sợ hãi, và thay vào đó là những trò tiêu khiển liều lĩnh. Nhảy thì được, nhưng bớt tự vấp phải dây giày của mình đi.","Hôm nay kêu gọi một cuộc phiêu lưu hoàn toàn không có kịch bản. Bạn đang có cơ hội để làm mới năng lượng của mình bằng cách vứt bỏ những lịch trình cứng nhắc. Cảm giác chông chênh lúc này là tín hiệu tốt, nó cho thấy bạn đang thực sự sống chứ không phải tồn tại qua ngày.

Cứ xách balo lên đi một chuyến ngẫu hứng, hoặc thử một kỹ năng mới mà bạn chưa từng nghĩ tới. Hãy để bản năng lấn át những toan tính lý trí. Tin tưởng vào cú nhảy với đôi mắt mở to và để cuộc sống làm bạn bất ngờ.","Bạn đang hành động bốc đồng chỉ vì chán nản, và nói thật nhé, trông chẳng ngầu chút nào. Bỏ dở một dự án giữa chừng chỉ để bắt đầu cái mới không phải là 'thuận theo tự nhiên', đó là trôi dạt vô định. Bạn đang nhầm lẫn giữa sự giải phóng và việc trốn tránh hậu quả.

Hãy chậm lại, thừa nhận xem bạn thực sự đang sợ hãi điều gì. Kéo đôi chân mình chạm đất trước khi định nhảy. Đừng đưa ra bất kỳ quyết định bốc đồng nào trong hôm nay chỉ để thỏa mãn cảm giác muốn chạy trốn.","Đã đến lúc đề xuất cái ý tưởng hơi 'điên rồ' mà bạn cứ giấu nhẹm đi. Đừng quá bận tâm đến việc mọi thứ phải hoàn hảo ngay từ đầu. Năng lượng của The Fool ủng hộ việc thử nghiệm, sai lầm, và học hỏi ngay trên chính quá trình thực thi.

Hãy thử thay đổi hoàn toàn quy trình làm việc xem sao. Áp dụng một phần mềm lạ hoắc hoặc đổi góc ngồi làm việc. Phép màu nằm ở những điều chưa biết, hãy tin vào cú nhảy với đôi mắt mở to và để sự sáng tạo dẫn đường.","Việc gửi một chiếc email đầy mùi cà khịa cho sếp hay bùng họp chỉ vì 'không có hứng' là tấm vé một chiều dẫn đến rắc rối đấy. Bạn đang nhầm lẫn giữa sự độc lập trong công việc và hành động tự hủy hoại (self-sabotage). Bạn cảm thấy ngột ngạt nhưng lại chọn cách phá bĩnh thay vì giải quyết.

Đừng bốc đồng rời bỏ vị trí khi chưa thực sự hiểu rõ bài học mà mình cần vượt qua. Hãy bình tâm lại, hoàn thành những task nhỏ nhất đang tồn đọng. Kỷ luật lúc này mới là thứ cứu rỗi bạn, chứ không phải sự nổi loạn.","Tình yêu không cần phải là một kịch bản được biên đạo kỹ lưỡng. Năng lượng hôm nay cực kỳ tươi mới, rất thích hợp để bạn gột rửa những định kiến hay cãi vã cũ kỹ. Nếu đang độc thân, bạn rất dễ va phải một mối duyên bất ngờ đầy thú vị.

Lên xe và lái đến một nơi mà cả hai chưa từng đến để ăn tối, không thèm đặt bàn trước luôn. Hãy hoàn toàn hiện diện, hạ lớp phòng bị xuống và để sự gắn kết được định hình bởi sự tò mò vô tư của khoảnh khắc hiện tại.","Bạn đang lẩn tránh những cuộc trò chuyện sâu sắc và tỏ ra xa lánh về mặt cảm xúc rồi gọi đó là 'bảo vệ bình yên nội tâm'. Thực ra bạn chỉ đang đẩy người kia vào thế phải đối mặt với thực tế một mình. Sự vô tâm đang được bạn ngụy trang thành ranh giới cá nhân.

Dừng ngay cái lối mòn chạy trốn này lại trước khi nó phá hỏng mối quan hệ của bạn. Đối mặt với sự thật đi, dù cuộc trò chuyện có gượng gạo đến mức nào. Trưởng thành lên và chịu trách nhiệm cho cảm xúc của mình.","Vũ trụ đồng ý cho bạn thử sức với một lĩnh vực hoàn toàn mới. Năng lượng tài chính đang rộng mở nếu bạn dám rũ bỏ nỗi sợ thiếu thốn. Một khoản đầu tư mang tính trải nghiệm lúc này có thể không mang lại lợi nhuận ngay lập tức, nhưng sẽ mở ra những cánh cửa lớn hơn trong tương lai.

Cứ mạnh dạn đầu tư vào cái dự án làm thêm kỳ quặc đó, hoặc mua thiết bị mà bạn đã nhắm từ lâu để phục vụ đam mê. Xóa bỏ những lo âu đi và tin rằng một góc nhìn mới mẻ sẽ thu hút sự trù phú.","Bỏ cái thẻ tín dụng xuống ngay. Quẹt thủng thẻ cho những món đồ mua bốc đồng lúc 2 giờ sáng vì stress hoàn toàn trái ngược với tự do tài chính. Hoặc ngược lại, bạn đang sợ hãi đến mức tê liệt và không dám xuống tiền cho một khoản đầu tư cần thiết.

Hãy gỡ rối nỗi sợ trước khi hành động thực tế. Lập ngay một bảng thống kê chi tiêu đơn giản để biết tiền của mình đang đi đâu. Kéo bản thân về mặt đất trước khi ném tiền qua cửa sổ cho những trò vui vô bổ.","Não bạn bây giờ giống như cái trình duyệt mở 50 tab, và The Fool bảo bạn hãy bấm 'Đóng tất cả'. Bạn đang bị quá tải bởi những suy nghĩ phân tích nặng nề. Sự trong trẻo của tâm trí chỉ quay lại khi bạn chấp nhận buông bỏ nhu cầu phải biết trước mọi đáp án.

Ra ngoài ngồi, nhìn một đám mây kỳ quái nào đó, và cứ thế tồn tại trong mười phút mà đừng cố gắng tối ưu hóa thời gian hay giải quyết vấn đề. Hãy để tâm trí được trống rỗng, linh cảm tốt nhất sẽ xuất hiện từ chính sự tĩnh lặng này.","Bạn đang tự chìm vào mớ lo âu trừu tượng do chính mình bịa ra chỉ vì không muốn giải quyết sự thật nhàm chán ngay trước mắt. Đừng dùng cái cớ 'phát triển bản thân' hay 'đi tìm chính mình' để lẩn tránh việc đối mặt với mớ hỗn độn hiện tại.

Gọi tên sự bóp méo đó một cách nhẹ nhàng. Ngắt kết nối mạng một lúc, ngừng lướt các video chữa lành sáo rỗng. Hãy quay về với những gì bạn biết chắc chắn là sự thật để lấy lại thăng bằng cho đôi chân mình."
the-magician,major,1,"","","",The Magician,Major Arcana · I,Major Arcana. Fill all content_* columns.,The Magician,Major Arcana · I,Will,Will|Focus|Skill|Manifestation,"The raised hand and ritual tools show alignment between idea, speech, and action.","Raw force becomes real when intention, focus, and action line up.","The shadow appears as scattered power, manipulation, or speaking of magic without grounding it.","Raw force becomes real when intention, focus, and action line up.","Scattered power, manipulation, or speaking of magic without grounding it.","At work, gather your will into one clear channel.","At work, scattered power, manipulation, or speaking of magic without grounding it.","In relationships, gather your will into one clear channel.","In relationships, scattered power, manipulation, or speaking of magic without grounding it.","With money, gather your will into one clear channel.","With money, scattered power, manipulation, or speaking of magic without grounding it.","Mentally, gather your will into one clear channel.","Mentally, scattered power, manipulation, or speaking of magic without grounding it.",Nhà Ảo Thuật,Ẩn Chính · I,Kiến Tạo,Ý Chí|Tập Trung|Kỹ Năng|Hiện Thực Hóa,"Bàn tay nâng lên cùng những pháp cụ nghi lễ cho thấy sự thẳng hàng giữa ý tưởng, lời nói, và hành động.","Lá bài The Magician báo hiệu bạn đã có đủ đồ nghề trong tay: kỹ năng, sự tự tin và khéo léo để xoay chuyển tình thế. Đừng chờ đợi phép màu, chính bạn là người tạo ra nó. Đây là thời điểm vàng để ráp nối các ý tưởng lại với nhau và biến một ngày bình thường thành một kiệt tác mang đậm dấu ấn cá nhân của bạn.","Có vẻ như bạn đang nói hơi nhiều nhưng làm lại chẳng bao nhiêu thì phải? Những ý tưởng tuyệt vời sẽ mãi nằm trên giấy nếu bạn thiếu đi kỷ luật. Thay vì cứ mải mê 'phông bạt' về tương lai, hãy ngồi xuống và giải quyết dứt điểm việc đang trì hoãn. Đừng để tài năng bị lãng phí vì sự chây ì.","Hôm nay, bạn là đạo diễn cho chính sân khấu của mình. Mọi việc bạn đụng vào đều diễn ra trôi chảy nhờ tài ăn nói và sự nhạy bén. Bạn có khả năng nhìn thấy tiềm năng ở những thứ tưởng chừng vô ích và biết cách sắp xếp lại trật tự cho một mớ hỗn độn. Mọi người sẽ dễ dàng bị thuyết phục bởi sự chuẩn bị của bạn.

Hãy chủ động căn chỉnh lại môi trường xung quanh sao cho thuận lợi nhất với mục tiêu của mình. Bắt tay vào hiện thực hóa những gì bạn đang ấp ủ. Đừng ngại sử dụng sức ảnh hưởng và các mối quan hệ để chốt hạ mục tiêu.","Hôm nay bạn cần cẩn thận với những lời hứa hẹn bùi tai hoặc thông tin chưa được kiểm chứng. Năng lượng ngược báo hiệu sự thao túng hoặc cảm giác bất lực khi bạn có đồ nghề nhưng lại lóng ngóng. Rất dễ xảy ra tình trạng 'thùng rỗng kêu to', kế hoạch hoành tráng nhưng thiếu nền tảng.

Hãy chậm lại và tự tay kiểm tra mọi chi tiết trước khi gật đầu đồng ý. Nếu cảm thấy mông lung, hãy gạt bỏ bớt yếu tố gây nhiễu và tập trung vào một nhiệm vụ duy nhất. Sự thành thật với bản thân lúc này mới là phép thuật mạnh nhất.","Trong công việc, bạn đang nắm giữ lợi thế tuyệt đối để tỏa sáng. Những rào cản chuyên môn không thể làm khó bạn, bởi bộ não của bạn đang liên kết thông tin cực kỳ nhạy bén. Bạn dư sức hô biến một dự án đang bế tắc thành một thành phẩm mượt mà, ấn tượng khiến cấp trên nể phục.

Hãy mạnh dạn bước lên bục thuyết trình, gửi email đề xuất ý tưởng, hoặc yêu cầu một cơ hội mới. Lôi bộ công cụ của bạn ra, cắt bỏ đi những quy trình thừa thãi. Bạn có năng lực, hãy tự tin ra giá và trình diễn nó.","Bạn đang mắc kẹt trong mớ bòng bong do chính mình tạo ra vì tội ôm đồm hoặc lười biếng. Sự 'khôn vặt' hay cố gắng múa mép để che lấp deadline sẽ phản tác dụng, vì mọi người xung quanh tinh ý hơn bạn nghĩ. Bạn đang dùng chuyên môn để ngụy biện thay vì tạo ra kết quả.

Hãy dừng ngay việc hứa hẹn thêm những điều vượt quá khả năng. Mở máy lên, chia nhỏ khối lượng công việc khổng lồ kia ra và giải quyết dứt điểm từng phần. Nhờ đồng nghiệp hỗ trợ sẽ khôn ngoan hơn là cố khoác lên chiếc áo hoàn hảo giả tạo.","Sức hút của bạn hôm nay tỏa ra vô cùng tự nhiên và mạnh mẽ. Khả năng giao tiếp khéo léo giúp bạn dễ dàng chạm đúng 'tần số' của đối phương chỉ qua vài câu trò chuyện. Trong tình yêu, một chút tinh tế và 'chiêu trò' đáng yêu chính là gia vị cần thiết để làm mối quan hệ trở nên thú vị hơn.

Hãy chủ động thiết kế một buổi hẹn hò đầy bất ngờ thay vì chờ đợi người kia lên tiếng. Gửi một tin nhắn trúng tim đen, nấu một món ăn mới. Hãy dùng sự duyên dáng của mình để tạo ra khoảnh khắc khiến đối phương không thể rời mắt.","Có những dấu hiệu của sự lấp liếm hoặc những lời hứa rỗng tuếch đang len lỏi vào mối quan hệ này. Có thể bạn đang dùng lý lẽ sắc bén để lấn át đối phương, hoặc bạn lờ mờ nhận ra người kia không thành thật. Việc né tránh vấn đề cốt lõi chỉ làm bức tường vô hình ngày càng dày thêm.

Hãy cất những lời bào chữa đi và ngồi xuống đối thoại trung thực nhất. Ngừng việc cố gắng thao túng cảm xúc của đối phương hay phớt lờ những cảnh báo cờ đỏ (red flag). Tình cảm cần sự minh bạch, không phải những vở kịch.","Tiền bạc hôm nay không phụ thuộc vào vận may, mà sinh ra từ chính sự tháo vát của bạn. Bạn có khả năng nhìn thấu cơ hội sinh lời mà người khác bỏ qua. Khả năng thương lượng của bạn rất bén, giúp bạn chiếm ưu thế trong các giao dịch, đàm phán lương thưởng.

Đừng ngần ngại chốt hạ những thỏa thuận tài chính quan trọng. Đăng bán món đồ cũ, khởi động dự án phụ (side-hustle) bạn đang ấp ủ, hoặc mạnh dạn đưa ra mức giá xứng đáng cho sức lao động của mình. Hãy hành động dứt khoát!","Ví tiền của bạn đang đứng trước nguy cơ bị 'rút ruột' bởi những quyết định bốc đồng hoặc cả tin. Lá bài cảnh báo việc ném tiền qua cửa sổ chỉ để mua những thứ bóng bẩy nhằm 'phông bạt'. Tuyệt đối tránh xa những lời rủ rê đầu tư 'việc nhẹ lương cao'.

Giữ chặt thẻ tín dụng và kiểm tra lại số dư trước khi ấn nút thanh toán. Học cách nói 'Không' thẳng thắn nếu có ai đó vay mượn với lời hứa hẹn mập mờ. Quản lý tài chính dựa trên con số thực tế, không phải viễn cảnh bánh vẽ.","Tâm trí bạn hôm nay sắc sảo, logic và đầy tính sáng tạo. Những nút thắt tư duy từng làm bạn đau đầu bỗng nhiên được gỡ bỏ dễ dàng, mọi mảnh ghép thông tin khớp lại hoàn hảo. Bạn hoàn toàn làm chủ được luồng suy nghĩ, không để cảm xúc tiêu cực chen ngang.

Hãy tin tưởng tuyệt đối vào năng lực trí tuệ của bản thân và ghi chép lại ngay những ý tưởng bất chợt. Giống như việc xóa sạch chi tiết rác khỏi bức ảnh, hãy dọn dẹp tâm trí để chủ thể quan trọng nhất nổi bật lên.","Bộ não thông minh của bạn đang bị lạm dụng để ngụy biện cho những thói quen xấu. Bạn tự vẽ ra hàng tá lý do thuyết phục để giải thích cho việc trì hoãn, không dám bước ra vùng an toàn. Sự suy diễn này khóa chặt năng lượng sáng tạo và khiến bạn cạn kiệt.

Ngừng việc phức tạp hóa vấn đề và bước ra khỏi cái bẫy tư duy do chính mình giăng ra. Bạn biết rõ sự thật nằm ở đâu. Hãy ngắt kết nối mạng một lúc, và bắt tay vào làm một hành động nhỏ nhất mang tính xây dựng."
